"name","suitable_for","description"
"Batik Parang","Acara Formal","Batik Parang dengan motif Parang Rusak adalah salah satu motif yang paling dikenal di Indonesia. Motif ini melambangkan perjalanan hidup yang penuh tantangan. Pada acara formal seperti pernikahan, batik ini menggambarkan kesan keteguhan hati dan kekuatan. Motif Parang Rusak juga digunakan dalam berbagai acara adat dan memiliki nilai historis yang mendalam"
"Batik Mega Mendung","Acara Keluarga","Batik Mega Mendung berasal dari Cirebon dan menggambarkan bentuk awan mendung yang besar dan dramatis. Motif ini melambangkan kesuburan dan keharmonisan. Batik Mega Mendung sangat cocok untuk digunakan pada acara formal dan juga acara keluarga. Desainnya yang halus dan elegan membuatnya menjadi pilihan tepat bagi mereka yang ingin terlihat anggun namun tetap terkesan penuh makna"
"Batik Kawung","Casual","Motif Kawung adalah motif batik yang memiliki bentuk seperti lingkaran dengan empat titik di tengahnya. Motif ini melambangkan filosofi kehidupan yang berbasis pada kesucian dan harmoni. Batik Kawung cocok dipakai untuk acara formal maupun casual. Dengan desain yang sederhana namun penuh makna, batik ini sangat populer di kalangan generasi muda dan sering dikenakan dalam berbagai acara penting."
"Batik Truntum","Pernikahan","Batik Truntum dengan motif bunga yang melambangkan cinta dan kasih sayang sering digunakan dalam upacara pernikahan. Pada acara keluarga, motif ini menggambarkan hubungan yang harmonis antara anggota keluarga. Batik Truntum juga melambangkan penguatan hubungan, serta sebagai simbol pengharapan bagi pasangan yang baru menikah. Desainnya yang anggun dan penuh makna spiritual menjadikan batik ini favorit dalam berbagai kesempatan."
"Batik Jlamprang","Pesta","Batik Jlamprang memiliki motif yang sangat dinamis dan penuh warna. Batik ini melambangkan kemakmuran dan kebahagiaan, sehingga sangat cocok digunakan dalam acara pernikahan atau pesta. Dengan kombinasi warna yang hidup dan desain yang mencolok, Batik Jlamprang memberikan kesan yang mewah dan elegan, menjadikannya pilihan sempurna untuk acara-acara penting dan meriah."
"Batik Ceplok","Acara Formal","Batik Ceplok adalah batik dengan motif yang berulang dan terstruktur, memberi kesan formal dan elegan. Motif yang teratur melambangkan keseimbangan dalam hidup, serta kesan klasik yang tak lekang oleh waktu. Batik ini sering dipakai untuk acara formal dan pernikahan, serta memberi tampilan yang anggun dan penuh kebanggaan."
"Batik Sekar Jagad","Acara Keluarga","Motif Sekar Jagad menggambarkan keindahan alam semesta yang beragam. Batik dengan motif ini melambangkan kebahagiaan dan keharmonisan dalam kehidupan. Batik Sekar Jagad cocok digunakan untuk acara formal maupun keluarga, memberikan kesan yang berwibawa namun tetap santai. Desain motif ini memperlihatkan kedalaman filosofi yang berkaitan erat dengan nilai-nilai luhur dalam masyarakat Indonesia."
"Batik Lasem","Pernikahan","Batik Lasem dengan motif khas yang terinspirasi dari budaya Tionghoa ini melambangkan keindahan dan ketahanan hidup. Dengan warna merah yang mendominasi, batik Lasem sering digunakan dalam acara formal dan pernikahan, membawa kesan elegan dan penuh simbolisme. Batik Lasem juga dikenal sebagai batik dengan cerita sejarah yang kaya, mengandung makna tentang kekuatan dan keberanian."
"Batik Buketan","Pesta","Batik Buketan dengan motif bunga yang berwarna-warni melambangkan keindahan dan kemakmuran. Batik ini sering digunakan untuk acara pernikahan dan pesta, memberikan kesan ceria dan meriah. Keindahan motif buketan yang dipenuhi dengan bunga memberi kesan elegan dan feminim, menjadikannya pilihan yang sempurna untuk acara-acara besar yang penuh dengan kebahagiaan."
"Batik Pekalongan","Acara Formal","Batik Pekalongan dikenal dengan motif yang berwarna cerah dan desain yang sangat detail. Batik ini sangat cocok untuk acara formal dan pernikahan karena memberi kesan mewah dan anggun. Motif batik Pekalongan melambangkan keberagaman budaya dan kesejahteraan, menjadikannya pilihan populer untuk berbagai perayaan dan acara penting."
"Batik Sidomukti","Pernikahan","Batik Sidomukti merupakan batik dengan motif geometris yang kuat, melambangkan keberuntungan dan kesuksesan. Motif ini sering digunakan dalam acara formal dan pernikahan, karena memberikan kesan penuh harapan dan kebahagiaan. Batik Sidomukti adalah pilihan yang sangat tepat bagi mereka yang menginginkan tampilan yang elegan dan membawa simbol positif dalam hidup."
"Batik Cuwiri","Casual","Batik Cuwiri dengan motif yang sederhana namun elegan sering digunakan dalam acara keluarga atau kegiatan casual. Batik ini melambangkan kedamaian dan keseimbangan dalam hidup. Desainnya yang tidak terlalu mencolok membuatnya cocok dipakai di berbagai kesempatan santai, tetapi tetap memberi kesan yang elegan dan menyenangkan."
"Batik Bunga","Casual","Batik Bunga dengan motif bunga yang hidup dan penuh warna sangat cocok untuk acara pesta atau kegiatan casual. Motif bunga menggambarkan keindahan alam yang melambangkan kehidupan yang penuh warna dan energi. Batik ini memberikan kesan segar dan ceria, menjadikannya pilihan tepat untuk acara yang penuh kegembiraan."
"Batik Tujuh Rupa","Acara Keluarga","Batik Tujuh Rupa memiliki motif yang penuh warna, melambangkan keberagaman dan kebersamaan. Motif ini cocok untuk digunakan dalam acara keluarga dan pesta, menciptakan suasana yang hangat dan meriah. Batik Tujuh Rupa menggambarkan kesatuan dari berbagai elemen yang berbeda dalam kehidupan, membawa pesan tentang pentingnya toleransi dan kerja sama."
"Batik Barong","Acara Formal","Batik Barong dengan motif wajah barong yang penuh makna ini melambangkan kekuatan, perlindungan, dan keberanian. Batik ini cocok untuk acara formal dan pernikahan, memberikan kesan yang kuat dan agung. Motif Barong sering kali digunakan dalam upacara adat sebagai simbol perlindungan bagi pasangan yang baru menikah, membawa berkah dan kebahagiaan."
"Batik Batu","Pernikahan","Batik Batu dengan motif yang sederhana namun elegan cocok digunakan pada acara formal dan pernikahan. Motif batu melambangkan kestabilan dan ketahanan dalam hidup. Batik ini memberikan kesan yang kokoh dan penuh makna, menjadikannya pilihan tepat untuk acara yang mengedepankan keanggunan tanpa kehilangan nilai tradisional."
"Batik Selendang","Pesta","Batik Selendang dengan motif yang halus dan ringan memberi kesan elegan namun santai. Cocok untuk digunakan pada acara casual maupun pesta, batik ini memberikan tampilan yang anggun dan feminim. Motif selendang yang mengalir melambangkan kelembutan dan kebebasan, cocok untuk acara yang tidak terlalu formal namun tetap membutuhkan sentuhan keanggunan."
"Batik Lurik","Acara Keluarga","Batik Lurik dengan motif garis-garis yang sederhana namun kaya akan filosofi ini sering digunakan pada acara keluarga atau kegiatan casual. Batik Lurik melambangkan kesederhanaan, kedamaian, dan ketenangan. Meskipun sederhana, batik ini memberikan kesan yang elegan dan penuh karakter, cocok untuk dipakai dalam kegiatan sehari-hari yang tetap menjaga nilai budaya."
"Batik Cempaka","Pernikahan","Batik Cempaka dengan motif bunga cempaka yang indah ini melambangkan kesucian dan keindahan. Batik ini cocok untuk acara pernikahan atau pesta, memberikan kesan lembut dan anggun. Dengan desain yang elegan dan penuh warna, Batik Cempaka sering dipilih untuk memperindah penampilan dalam momen-momen bahagia."
"Batik Tulis","Acara Formal","Batik Tulis adalah batik yang dibuat dengan tangan, dan setiap goresannya memiliki nilai seni yang tinggi. Motif tulisan tangan ini memberi kesan personal dan istimewa, cocok untuk acara formal dan pernikahan. Setiap helai Batik Tulis memiliki ciri khas yang unik, melambangkan keindahan dan ketekunan dalam setiap detail."
